{"$id":"https://github.com/rdemb/delta-witness/research/DW-001/schema/claim-relevant-path-prior-art-log.schema.json","$schema":"https://json-schema.org/draft/2020-12/schema","additionalProperties":false,"properties":{"catalog_sha256":{"const":"f36fbe58c00cfb8ed0fd994f3bb1dcdb45040774f7ae4663563b9f40ac15daa5"},"closest_baselines":{"items":false,"maxItems":5,"minItems":5,"prefixItems":[{"additionalProperties":false,"properties":{"baseline_id":{"const":"raw-selector-context-paths"},"captures":{"const":"Exact per-selector executed statement and arc shapes."},"not_claimed":{"const":"No claim relevance or oracle strength."},"order":{"const":1},"planned_comparison":{"const":"Distinguish all decision and collateral routes."}},"required":["order","baseline_id","captures","planned_comparison","not_claimed"],"type":"object"},{"additionalProperties":false,"properties":{"baseline_id":{"const":"explicit-route-membership"},"captures":{"const":"Exact declared decision and collateral route labels."},"not_claimed":{"const":"No evidence that declared labels match actual execution."},"order":{"const":2},"planned_comparison":{"const":"Prefer this simpler baseline if it captures every runtime distinction."}},"required":["order","baseline_id","captures","planned_comparison","not_claimed"],"type":"object"},{"additionalProperties":false,"properties":{"baseline_id":{"const":"fixed-assertion-influence-graph"},"captures":{"const":"Exact project-owned dependence relation from inputs/routes to returned fields."},"not_claimed":{"const":"No general static or dynamic slicing."},"order":{"const":3},"planned_comparison":{"const":"Separate decision-route from collateral-only computation."}},"required":["order","baseline_id","captures","planned_comparison","not_claimed"],"type":"object"},{"additionalProperties":false,"properties":{"baseline_id":{"const":"typed-claim-and-collateral-assertions"},"captures":{"const":"Exact behavior of claim-facing and separately labeled collateral reference checks."},"not_claimed":{"const":"No complete specification."},"order":{"const":4},"planned_comparison":{"const":"Prevent collateral failures from satisfying the authorization claim."}},"required":["order","baseline_id","captures","planned_comparison","not_claimed"],"type":"object"},{"additionalProperties":false,"properties":{"baseline_id":{"const":"fixed-fault-incidence"},"captures":{"const":"Exact typed outcomes for route-local, shared, collateral, and neutral-diversion controls."},"not_claimed":{"const":"No mutation adequacy or method superiority."},"order":{"const":5},"planned_comparison":{"const":"Test bounded relation between influence and fault detection."}},"required":["order","baseline_id","captures","planned_comparison","not_claimed"],"type":"object"}],"type":"array"},"log_id":{"const":"DW-001-CLAIM-RELEVANT-PATH-PRIOR-ART-LOG-V1"},"log_sha256":{"const":"5f697631a5ded7a413dd11f4da0606ee8809e2b0f5de257ecab53a7e2d7f790c"},"novelty_boundary":{"additionalProperties":false,"properties":{"award_level_significance_claim_allowed":{"const":false},"novelty_status":{"const":"not_established"},"scientific_novelty_claim_allowed":{"const":false},"systematic_review_complete":{"const":false}},"required":["novelty_status","systematic_review_complete","scientific_novelty_claim_allowed","award_level_significance_claim_allowed"],"type":"object"},"plan_id":{"const":"DW-001-CLAIM-RELEVANT-PATH-DIVERGENCE-PLAN-V1"},"plan_sha256":{"const":"ff0403132c3424fc7309a15a05794eed93ac9eb526de172e17326f8409ca0888"},"planned_difference":{"additionalProperties":false,"properties":{"negative_control":{"const":"Reject-all-path-divergence is expected to over-refuse at least one valid control."},"question":{"const":"Whether integrity-bound runtime path evidence can be filtered by one exact assertion-influence control without conflating collateral divergence with claim failure."},"simpler_baseline_preferred_if_equivalent":{"const":true}},"required":["question","simpler_baseline_preferred_if_equivalent","negative_control"],"type":"object"},"policy":{"additionalProperties":false,"properties":{"award_level_significance_claim_allowed":{"const":false},"deployment_authorized":{"const":false},"ecological_inference_allowed":{"const":false},"external_repository_execution_authorized":{"const":false},"headline_score":{"const":null},"holdout_selected":{"const":false},"merge_blocker_authorized":{"const":false},"method_superiority_claim_allowed":{"const":false},"mutation_score":{"const":null},"primary_denominator_eligible":{"const":false},"production_readiness_claim_allowed":{"const":false},"quality_score":{"const":null},"release_authorized":{"const":false},"scientific_novelty_claim_allowed":{"const":false},"universal_threshold":{"const":null}},"required":["quality_score","headline_score","mutation_score","universal_threshold","merge_blocker_authorized","ecological_inference_allowed","holdout_selected","primary_denominator_eligible","external_repository_execution_authorized","release_authorized","deployment_authorized","method_superiority_claim_allowed","production_readiness_claim_allowed","scientific_novelty_claim_allowed","award_level_significance_claim_allowed"],"type":"object"},"reviewed_at":{"const":"2026-08-18"},"schema_version":{"const":"deltawitness.dw001-claim-relevant-path-prior-art-log.v1"},"sources":{"items":false,"maxItems":6,"minItems":6,"prefixItems":[{"additionalProperties":false,"properties":{"baseline_role":{"const":"Exact statement, arc, branch-statistic, and per-selector context evidence."},"boundary":{"const":"Execution structure does not establish assertion influence or oracle adequacy."},"identifier":{"const":"https://coverage.readthedocs.io/en/7.15.2/"},"order":{"const":1},"source_id":{"const":"coveragepy-7.15.2-contexts-api"},"source_type":{"const":"official-versioned-tool-documentation"},"title":{"const":"Coverage.py measurement contexts and public API"}},"required":["order","source_id","title","source_type","identifier","baseline_role","boundary"],"type":"object"},{"additionalProperties":false,"properties":{"baseline_role":{"const":"Dynamic slice of covered statements influencing an oracle."},"boundary":{"const":"This preregistration does not implement or claim general checked coverage."},"identifier":{"const":"10.1002/stvr.1497"},"order":{"const":2},"source_id":{"const":"schuler-zeller-checked-coverage"},"source_type":{"const":"peer-reviewed-primary-research"},"title":{"const":"Checked coverage: an indicator for oracle quality"}},"required":["order","source_id","title","source_type","identifier","baseline_role","boundary"],"type":"object"},{"additionalProperties":false,"properties":{"baseline_role":{"const":"Execution-specific program dependence and slicing."},"boundary":{"const":"The fixed influence graph is one project-owned control, not a dynamic slicer."},"identifier":{"const":"Information Processing Letters 29(3), 1988"},"order":{"const":3},"source_id":{"const":"korel-laski-dynamic-slicing"},"source_type":{"const":"peer-reviewed-primary-research"},"title":{"const":"Dynamic Program Slicing"}},"required":["order","source_id","title","source_type","identifier","baseline_role","boundary"],"type":"object"},{"additionalProperties":false,"properties":{"baseline_role":{"const":"Foundational slicing criterion and dependence abstraction."},"boundary":{"const":"No general static slicing claim is made."},"identifier":{"const":"IEEE TSE 10(4), 1984"},"order":{"const":4},"source_id":{"const":"weiser-program-slicing"},"source_type":{"const":"peer-reviewed-primary-research"},"title":{"const":"Program Slicing"}},"required":["order","source_id","title","source_type","identifier","baseline_role","boundary"],"type":"object"},{"additionalProperties":false,"properties":{"baseline_role":{"const":"Limits of determining expected behavior and oracle adequacy."},"boundary":{"const":"The fixed assertions are project-owned controls, not a solution to the oracle problem."},"identifier":{"const":"10.1109/TSE.2014.2372785"},"order":{"const":5},"source_id":{"const":"barr-oracle-survey"},"source_type":{"const":"peer-reviewed-survey"},"title":{"const":"The Oracle Problem in Software Testing: A Survey"}},"required":["order","source_id","title","source_type","identifier","baseline_role","boundary"],"type":"object"},{"additionalProperties":false,"properties":{"baseline_role":{"const":"Mutation operators, adequacy, equivalence, and cost."},"boundary":{"const":"The fixed catalog is not representative and produces no mutation score."},"identifier":{"const":"10.1109/TSE.2010.62"},"order":{"const":6},"source_id":{"const":"jia-harman-mutation-survey"},"source_type":{"const":"peer-reviewed-survey"},"title":{"const":"An Analysis and Survey of the Development of Mutation Testing"}},"required":["order","source_id","title","source_type","identifier","baseline_role","boundary"],"type":"object"}],"type":"array"},"status":{"const":"pre_execution_literature_boundary"},"study_id":{"const":"DW-001"}},"required":["schema_version","study_id","log_id","status","reviewed_at","plan_id","plan_sha256","catalog_sha256","sources","closest_baselines","planned_difference","novelty_boundary","policy","log_sha256"],"title":"DeltaWitness DW-001 Claim-Relevant Path Prior-Art Log v1","type":"object"}
