{"catalog_sha256":"f36fbe58c00cfb8ed0fd994f3bb1dcdb45040774f7ae4663563b9f40ac15daa5","closest_baselines":[{"baseline_id":"raw-selector-context-paths","captures":"Exact per-selector executed statement and arc shapes.","not_claimed":"No claim relevance or oracle strength.","order":1,"planned_comparison":"Distinguish all decision and collateral routes."},{"baseline_id":"explicit-route-membership","captures":"Exact declared decision and collateral route labels.","not_claimed":"No evidence that declared labels match actual execution.","order":2,"planned_comparison":"Prefer this simpler baseline if it captures every runtime distinction."},{"baseline_id":"fixed-assertion-influence-graph","captures":"Exact project-owned dependence relation from inputs/routes to returned fields.","not_claimed":"No general static or dynamic slicing.","order":3,"planned_comparison":"Separate decision-route from collateral-only computation."},{"baseline_id":"typed-claim-and-collateral-assertions","captures":"Exact behavior of claim-facing and separately labeled collateral reference checks.","not_claimed":"No complete specification.","order":4,"planned_comparison":"Prevent collateral failures from satisfying the authorization claim."},{"baseline_id":"fixed-fault-incidence","captures":"Exact typed outcomes for route-local, shared, collateral, and neutral-diversion controls.","not_claimed":"No mutation adequacy or method superiority.","order":5,"planned_comparison":"Test bounded relation between influence and fault detection."}],"log_id":"DW-001-CLAIM-RELEVANT-PATH-PRIOR-ART-LOG-V1","log_sha256":"5f697631a5ded7a413dd11f4da0606ee8809e2b0f5de257ecab53a7e2d7f790c","novelty_boundary":{"award_level_significance_claim_allowed":false,"novelty_status":"not_established","scientific_novelty_claim_allowed":false,"systematic_review_complete":false},"plan_id":"DW-001-CLAIM-RELEVANT-PATH-DIVERGENCE-PLAN-V1","plan_sha256":"ff0403132c3424fc7309a15a05794eed93ac9eb526de172e17326f8409ca0888","planned_difference":{"negative_control":"Reject-all-path-divergence is expected to over-refuse at least one valid control.","question":"Whether integrity-bound runtime path evidence can be filtered by one exact assertion-influence control without conflating collateral divergence with claim failure.","simpler_baseline_preferred_if_equivalent":true},"policy":{"award_level_significance_claim_allowed":false,"deployment_authorized":false,"ecological_inference_allowed":false,"external_repository_execution_authorized":false,"headline_score":null,"holdout_selected":false,"merge_blocker_authorized":false,"method_superiority_claim_allowed":false,"mutation_score":null,"primary_denominator_eligible":false,"production_readiness_claim_allowed":false,"quality_score":null,"release_authorized":false,"scientific_novelty_claim_allowed":false,"universal_threshold":null},"reviewed_at":"2026-08-18","schema_version":"deltawitness.dw001-claim-relevant-path-prior-art-log.v1","sources":[{"baseline_role":"Exact statement, arc, branch-statistic, and per-selector context evidence.","boundary":"Execution structure does not establish assertion influence or oracle adequacy.","identifier":"https://coverage.readthedocs.io/en/7.15.2/","order":1,"source_id":"coveragepy-7.15.2-contexts-api","source_type":"official-versioned-tool-documentation","title":"Coverage.py measurement contexts and public API"},{"baseline_role":"Dynamic slice of covered statements influencing an oracle.","boundary":"This preregistration does not implement or claim general checked coverage.","identifier":"10.1002/stvr.1497","order":2,"source_id":"schuler-zeller-checked-coverage","source_type":"peer-reviewed-primary-research","title":"Checked coverage: an indicator for oracle quality"},{"baseline_role":"Execution-specific program dependence and slicing.","boundary":"The fixed influence graph is one project-owned control, not a dynamic slicer.","identifier":"Information Processing Letters 29(3), 1988","order":3,"source_id":"korel-laski-dynamic-slicing","source_type":"peer-reviewed-primary-research","title":"Dynamic Program Slicing"},{"baseline_role":"Foundational slicing criterion and dependence abstraction.","boundary":"No general static slicing claim is made.","identifier":"IEEE TSE 10(4), 1984","order":4,"source_id":"weiser-program-slicing","source_type":"peer-reviewed-primary-research","title":"Program Slicing"},{"baseline_role":"Limits of determining expected behavior and oracle adequacy.","boundary":"The fixed assertions are project-owned controls, not a solution to the oracle problem.","identifier":"10.1109/TSE.2014.2372785","order":5,"source_id":"barr-oracle-survey","source_type":"peer-reviewed-survey","title":"The Oracle Problem in Software Testing: A Survey"},{"baseline_role":"Mutation operators, adequacy, equivalence, and cost.","boundary":"The fixed catalog is not representative and produces no mutation score.","identifier":"10.1109/TSE.2010.62","order":6,"source_id":"jia-harman-mutation-survey","source_type":"peer-reviewed-survey","title":"An Analysis and Survey of the Development of Mutation Testing"}],"status":"pre_execution_literature_boundary","study_id":"DW-001"}
